{
  "schema_version": "0.1.0",
  "kind": "tile_plan",
  "path_id": "data_analyst",
  "batch_id": "final_batch_002_da_canary_llm",
  "tiles": [
    {
      "tile_id": "tile_data_shape_and_types",
      "region_id": "region_data_analysis_foundations",
      "terrain_id": "terrain_data_analysis_foundations",
      "title": "Datasets and Variable Types",
      "concept_ids": [
        "data.dataset_rows_columns",
        "data.categorical_numeric_types"
      ],
      "cluster_ids": [
        "cluster_001"
      ],
      "next_tile_id": null,
      "steps": [
        {
          "step_id": "tile_data_shape_and_types.s01",
          "type": "explainer",
          "concept_ids": [
            "data.dataset_rows_columns"
          ],
          "teaching_block_ids": [
            "data.dataset_rows_columns#tb1",
            "data.dataset_rows_columns#tb2"
          ],
          "fact_ids": [
            "data.dataset_rows_columns#f1",
            "data.dataset_rows_columns#f2"
          ],
          "segment_ids": [],
          "anchors": [
            "data.dataset_rows_columns#visual"
          ],
          "planned_interaction_type": null,
          "planned_visual_block_type": "data_table",
          "visual_purpose": "A small labelled table of delivery orders where one row and one column are visibly highlighted as an observation and a variable.",
          "word_budget": 151,
          "mapping_rule": null
        },
        {
          "step_id": "tile_data_shape_and_types.s02",
          "type": "explainer",
          "concept_ids": [
            "data.dataset_rows_columns"
          ],
          "teaching_block_ids": [
            "data.dataset_rows_columns#tb3",
            "data.dataset_rows_columns#tb4"
          ],
          "fact_ids": [
            "data.dataset_rows_columns#f3",
            "data.dataset_rows_columns#f4"
          ],
          "segment_ids": [],
          "anchors": [],
          "planned_interaction_type": null,
          "planned_visual_block_type": null,
          "visual_purpose": null,
          "word_budget": 160,
          "mapping_rule": null
        },
        {
          "step_id": "tile_data_shape_and_types.s03",
          "type": "check",
          "concept_ids": [
            "data.dataset_rows_columns"
          ],
          "teaching_block_ids": [],
          "fact_ids": [
            "data.dataset_rows_columns#f4"
          ],
          "segment_ids": [],
          "anchors": [
            "data.dataset_rows_columns#assessment:identify_column_as_variable"
          ],
          "planned_interaction_type": "choice",
          "planned_visual_block_type": null,
          "visual_purpose": null,
          "word_budget": 0,
          "mapping_rule": "default_check"
        },
        {
          "step_id": "tile_data_shape_and_types.s04",
          "type": "hands_on",
          "concept_ids": [
            "data.dataset_rows_columns"
          ],
          "teaching_block_ids": [],
          "fact_ids": [
            "data.dataset_rows_columns#f1",
            "data.dataset_rows_columns#f2",
            "data.dataset_rows_columns#f3",
            "data.dataset_rows_columns#f4"
          ],
          "segment_ids": [],
          "anchors": [
            "data.dataset_rows_columns#practice",
            "data.dataset_rows_columns#assessment:describe_dataset_structure",
            "data.dataset_rows_columns#assessment:identify_row_as_observation",
            "data.dataset_rows_columns#assessment:identify_column_as_variable"
          ],
          "planned_interaction_type": "table_select",
          "planned_visual_block_type": null,
          "visual_purpose": null,
          "word_budget": 0,
          "mapping_rule": "keyword rule -> table_select"
        },
        {
          "step_id": "tile_data_shape_and_types.s05",
          "type": "explainer",
          "concept_ids": [
            "data.categorical_numeric_types"
          ],
          "teaching_block_ids": [
            "data.categorical_numeric_types#tb1",
            "data.categorical_numeric_types#tb2",
            "data.categorical_numeric_types#tb3"
          ],
          "fact_ids": [
            "data.categorical_numeric_types#f1",
            "data.categorical_numeric_types#f2",
            "data.categorical_numeric_types#m1"
          ],
          "segment_ids": [],
          "anchors": [
            "data.categorical_numeric_types#visual"
          ],
          "planned_interaction_type": null,
          "planned_visual_block_type": "data_table",
          "visual_purpose": "A table whose columns are tagged categorical or numerical, with the numeric-looking code column visibly tagged categorical.",
          "word_budget": 195,
          "mapping_rule": null
        },
        {
          "step_id": "tile_data_shape_and_types.s06",
          "type": "check",
          "concept_ids": [
            "data.categorical_numeric_types"
          ],
          "teaching_block_ids": [],
          "fact_ids": [
            "data.categorical_numeric_types#f1",
            "data.categorical_numeric_types#f2"
          ],
          "segment_ids": [],
          "anchors": [
            "data.categorical_numeric_types#assessment:classify_variable_type"
          ],
          "planned_interaction_type": "choice",
          "planned_visual_block_type": null,
          "visual_purpose": null,
          "word_budget": 0,
          "mapping_rule": "default_check"
        },
        {
          "step_id": "tile_data_shape_and_types.s07",
          "type": "hands_on",
          "concept_ids": [
            "data.categorical_numeric_types"
          ],
          "teaching_block_ids": [],
          "fact_ids": [
            "data.categorical_numeric_types#m1"
          ],
          "segment_ids": [],
          "anchors": [
            "data.categorical_numeric_types#practice",
            "data.categorical_numeric_types#assessment:recognize_numeric_looking_categorical"
          ],
          "planned_interaction_type": "classify",
          "planned_visual_block_type": null,
          "visual_purpose": null,
          "word_budget": 0,
          "mapping_rule": "keyword rule -> classify"
        },
        {
          "step_id": "tile_data_shape_and_types.s08",
          "type": "recap",
          "concept_ids": [
            "data.dataset_rows_columns",
            "data.categorical_numeric_types"
          ],
          "teaching_block_ids": [
            "data.dataset_rows_columns#tb5",
            "data.categorical_numeric_types#tb4"
          ],
          "fact_ids": [
            "data.categorical_numeric_types#f1",
            "data.categorical_numeric_types#f2",
            "data.dataset_rows_columns#f1",
            "data.dataset_rows_columns#f2",
            "data.dataset_rows_columns#f3",
            "data.dataset_rows_columns#f4"
          ],
          "segment_ids": [],
          "anchors": [],
          "planned_interaction_type": null,
          "planned_visual_block_type": null,
          "visual_purpose": null,
          "word_budget": 90,
          "mapping_rule": "tile recap"
        }
      ],
      "needs": {
        "packs": [
          "core",
          "data"
        ],
        "block_types": [
          "data_table",
          "heading",
          "prose"
        ],
        "interaction_types": [
          "choice",
          "classify",
          "table_select"
        ],
        "runtimes": []
      },
      "warnings": []
    }
  ]
}
